<?xml version="1.0" encoding="UTF-8"?>
<!ELEMENT LOGIC (METHOD*)>
<!ELEMENT METHOD (PARAMETER*, RETURN?)>
<!ATTLIST METHOD
	NAME CDATA #REQUIRED
>
<!ELEMENT PARAMETER (#PCDATA)>
<!ATTLIST PARAMETER
	NAME CDATA #REQUIRED
	>
<!ELEMENT RETURN (#PCDATA)>
